{
  "schema_version": 1,
  "fixture_id": "synthetic-clean-side-12",
  "source_video_sha256": "a175d350c96db3df1771c1eb141a017eaed012ae6bbd6cda739510b244113096",
  "coordinate_space": "decoded_display_pixels",
  "implementation": {
    "name": "synthetic-offset-loss",
    "version": "1",
    "config": {
      "purpose": "golden-regression",
      "min_confidence_fixture": 0.5
    }
  },
  "runtime": {
    "processing_wall_s": 0.1
  },
  "samples": [
    {"timestamp_s": 0.0, "state": "tracked", "center_px": {"x_px": 103.0, "y_px": 194.0}, "confidence": 1.0},
    {"timestamp_s": 0.083333, "state": "tracked", "center_px": {"x_px": 104.0, "y_px": 186.0}, "confidence": 1.0},
    {"timestamp_s": 0.166667, "state": "tracked", "center_px": {"x_px": 105.0, "y_px": 174.0}, "confidence": 1.0},
    {"timestamp_s": 0.25, "state": "tracked", "center_px": {"x_px": 106.0, "y_px": 158.0}, "confidence": 1.0},
    {"timestamp_s": 0.333333, "state": "lost"},
    {"timestamp_s": 0.416667, "state": "tracked", "center_px": {"x_px": 102.0, "y_px": 119.0}, "confidence": 1.0},
    {"timestamp_s": 0.5, "state": "tracked", "center_px": {"x_px": 106.0, "y_px": 96.0}, "confidence": 1.0},
    {"timestamp_s": 0.583333, "state": "lost"},
    {"timestamp_s": 0.666667, "state": "tracked", "center_px": {"x_px": 108.0, "y_px": 76.0}, "confidence": 0.2},
    {"timestamp_s": 0.75, "state": "tracked", "center_px": {"x_px": 109.0, "y_px": 84.0}, "confidence": 1.0},
    {"timestamp_s": 0.833333, "state": "lost"}
  ]
}
